{"$schema":"https://json-schema.org/draft/2020-12/schema","title":"Competency evidence and developmental guidance","type":"object","additionalProperties":false,"required":["schema_version","status","source_of_truth","guidance"],"properties":{"schema_version":{"type":"string"},"status":{"enum":["draft","stable"]},"source_of_truth":{"type":"string","minLength":1},"guidance":{"type":"array","items":{"type":"object","additionalProperties":false,"required":["competency_id","age_policy","experience_progression","adult_responsibility","evidence_task","observer_questions","not_sufficient_evidence","fairness_cautions","boundaries"],"properties":{"competency_id":{"type":"string","pattern":"^(AI|BIZ|PRO|SOC)-[A-Z]{3}-[0-9]{3}$"},"age_policy":{"type":"string","minLength":10},"experience_progression":{"$ref":"#/$defs/stringList"},"adult_responsibility":{"type":"string","minLength":10},"evidence_task":{"type":"object","additionalProperties":false,"required":["setup","behaviors_to_elicit","artifacts_to_keep"],"properties":{"setup":{"type":"string","minLength":10},"behaviors_to_elicit":{"$ref":"#/$defs/stringList"},"artifacts_to_keep":{"$ref":"#/$defs/stringList"}}},"observer_questions":{"$ref":"#/$defs/stringList"},"not_sufficient_evidence":{"$ref":"#/$defs/stringList"},"fairness_cautions":{"$ref":"#/$defs/stringList"},"boundaries":{"$ref":"#/$defs/stringList"}}}}},"$defs":{"stringList":{"type":"array","minItems":1,"items":{"type":"string","minLength":1}}}}
