{
  "schema_version": "0.1.0",
  "status": "draft",
  "source_of_truth": "Generated from competencies.json plus subdomain adult-responsibility rules; do not edit directly.",
  "guidance": [
    {
      "competency_id": "AI-BND-001",
      "age_policy": "不按年龄固定能力等级；结合经验、支持条件、任务风险和迁移表现判断。",
      "experience_progression": [
        "在示例、分步说明或成人支持下尝试",
        "借助清单、模板或同伴协作完成",
        "在熟悉且低风险的情境中独立完成",
        "在新的复杂情境中迁移、权衡并说明决定"
      ],
      "adult_responsibility": "成人负责高风险用途、受限数据、工具许可和最终审批；青少年可以识别风险、暂停并求助。",
      "evidence_task": {
        "setup": "使用虚构、合成、公开或充分去标识化的材料，安排低风险、可逆的任务。",
        "behaviors_to_elicit": [
          "在使用 AI 前指出任务中可能出错或需要人工负责的环节。",
          "能够说明为什么某类信息不能只依赖 AI 输出。",
          "根据任务风险选择直接使用、核验后使用或不使用 AI。"
        ],
        "artifacts_to_keep": [
          "任务开始前的风险判断与人机分工记录。",
          "发现 AI 输出问题后调整流程并解释原因的版本记录。"
        ]
      },
      "observer_questions": [
        "学习者实际作出了哪些选择和判断？",
        "哪些结果来自 AI、同伴、教师或其他成人？",
        "学习者能否解释理由、限制以及需要求助的地方？",
        "换一种材料或情境后，相关行为能否再次出现？"
      ],
      "not_sufficient_evidence": [
        "只会复述‘AI 会产生幻觉’。",
        "在教师指出错误后简单修改答案。"
      ],
      "fairness_cautions": [
        "最终作品正确可能来自运气或外部帮助，不能单独证明边界判断能力。"
      ],
      "boundaries": [
        "不要求解释模型训练的全部技术原理。",
        "不等同于记忆一份固定的 AI 优缺点清单。",
        "不等同于对 AI 一律信任或一律拒绝。"
      ]
    },
    {
      "competency_id": "AI-COL-001",
      "age_policy": "不按年龄固定能力等级；结合经验、支持条件、任务风险和迁移表现判断。",
      "experience_progression": [
        "在示例、分步说明或成人支持下尝试",
        "借助清单、模板或同伴协作完成",
        "在熟悉且低风险的情境中独立完成",
        "在新的复杂情境中迁移、权衡并说明决定"
      ],
      "adult_responsibility": "成人确保工具与材料可安全使用；青少年负责说明自己的目标、选择、核验和修改。",
      "evidence_task": {
        "setup": "使用虚构、合成、公开或充分去标识化的材料，安排低风险、可逆的任务。",
        "behaviors_to_elicit": [
          "在开始任务时向 AI 提供必要背景、约束和可检查的完成标准。",
          "根据中间结果补充信息、调整提问或重新划分人与 AI 的工作。",
          "能够说明关键选择由谁作出，以及为什么保留、修改或拒绝 AI 建议。"
        ],
        "artifacts_to_keep": [
          "包含初始任务说明、中间结果、关键追问、人工选择和最终调整的完整记录。",
          "同一目标下比较不同人机分工方案并解释取舍。"
        ]
      },
      "observer_questions": [
        "学习者实际作出了哪些选择和判断？",
        "哪些结果来自 AI、同伴、教师或其他成人？",
        "学习者能否解释理由、限制以及需要求助的地方？",
        "换一种材料或情境后，相关行为能否再次出现？"
      ],
      "not_sufficient_evidence": [
        "只提交一个看起来专业的提示词。",
        "直接采用 AI 的首轮输出但无法说明人的贡献。"
      ],
      "fairness_cautions": [
        "高质量结果可能主要来自模型能力或现成模板，应检查学习者是否真正组织了协作过程。"
      ],
      "boundaries": [
        "不等同于记忆一套固定提示词公式。",
        "不以对话轮数或提示词长度判断协作质量。",
        "侧重协作流程，与核验输出的事实和逻辑质量相区分。"
      ]
    },
    {
      "competency_id": "AI-JUD-001",
      "age_policy": "不按年龄固定能力等级；结合经验、支持条件、任务风险和迁移表现判断。",
      "experience_progression": [
        "在示例、分步说明或成人支持下尝试",
        "借助清单、模板或同伴协作完成",
        "在熟悉且低风险的情境中独立完成",
        "在新的复杂情境中迁移、权衡并说明决定"
      ],
      "adult_responsibility": "医疗、法律、财务与安全结论必须由合格成人或专业人员核验，不能交由青少年最终决定。",
      "evidence_task": {
        "setup": "使用虚构、合成、公开或充分去标识化的材料，安排低风险、可逆的任务。",
        "behaviors_to_elicit": [
          "根据错误后果标出最需要核验的事实、推理步骤或遗漏。",
          "使用可追溯且与问题匹配的来源交叉检查关键主张。",
          "发现问题后修正结果，并记录修正依据和仍然存在的不确定性。"
        ],
        "artifacts_to_keep": [
          "带有原始输出、核验来源、问题标注、修订版本和不确定性说明的记录。",
          "能够解释为何选择某一核验强度和信息来源。"
        ]
      },
      "observer_questions": [
        "学习者实际作出了哪些选择和判断？",
        "哪些结果来自 AI、同伴、教师或其他成人？",
        "学习者能否解释理由、限制以及需要求助的地方？",
        "换一种材料或情境后，相关行为能否再次出现？"
      ],
      "not_sufficient_evidence": [
        "只让另一个 AI 判断原输出是否正确。",
        "结果恰好正确，但没有可检查的核验过程。"
      ],
      "fairness_cautions": [
        "引用来源数量不能替代来源质量、相关性和独立性的判断。"
      ],
      "boundaries": [
        "不要求对所有输出进行同等强度的核验。",
        "不等同于凭直觉表示赞同或怀疑。",
        "与判断是否应使用 AI 的边界能力相关，但侧重对具体输出的检查与纠正。"
      ]
    },
    {
      "competency_id": "BIZ-NED-001",
      "age_policy": "不按年龄固定能力等级；结合经验、支持条件、任务风险和迁移表现判断。",
      "experience_progression": [
        "在示例、分步说明或成人支持下尝试",
        "借助清单、模板或同伴协作完成",
        "在熟悉且低风险的情境中独立完成",
        "在新的复杂情境中迁移、权衡并说明决定"
      ],
      "adult_responsibility": "成人负责研究许可、安全边界与敏感对象保护；青少年不进入危险或私密场景取证。",
      "evidence_task": {
        "setup": "使用虚构、合成、公开或充分去标识化的材料，安排低风险、可逆的任务。",
        "behaviors_to_elicit": [
          "通过观察、访谈或已有材料描述具体的人、情境和困难。",
          "区分当事人的表达、自己的解释和仍待验证的假设。",
          "根据新信息修改原有问题描述。"
        ],
        "artifacts_to_keep": [
          "包含原始观察、访谈摘录、假设变化和问题重写过程的记录。",
          "能够说明哪些证据支持问题存在、哪些仍不确定。"
        ]
      },
      "observer_questions": [
        "学习者实际作出了哪些选择和判断？",
        "哪些结果来自 AI、同伴、教师或其他成人？",
        "学习者能否解释理由、限制以及需要求助的地方？",
        "换一种材料或情境后，相关行为能否再次出现？"
      ],
      "not_sufficient_evidence": [
        "只提交一张痛点清单。",
        "由 AI 直接生成用户需求但没有真实信息来源。"
      ],
      "fairness_cautions": [
        "表达能力强不必然代表问题洞察更深，应检查其信息来源和修订过程。"
      ],
      "boundaries": [
        "不等同于凭个人想象列举痛点。",
        "不要求问题已经具备明确商业价值。",
        "与提出解决方案分开，避免先有答案再寻找问题。"
      ]
    },
    {
      "competency_id": "BIZ-PRO-001",
      "age_policy": "不按年龄固定能力等级；结合经验、支持条件、任务风险和迁移表现判断。",
      "experience_progression": [
        "在示例、分步说明或成人支持下尝试",
        "借助清单、模板或同伴协作完成",
        "在熟悉且低风险的情境中独立完成",
        "在新的复杂情境中迁移、权衡并说明决定"
      ],
      "adult_responsibility": "成人负责产品安全、采购、合同和公开部署；青少年可在低风险原型中作设计取舍。",
      "evidence_task": {
        "setup": "使用虚构、合成、公开或充分去标识化的材料，安排低风险、可逆的任务。",
        "behaviors_to_elicit": [
          "说明方案服务的对象、问题以及本轮优先检验的关键假设。",
          "根据验证目的选择原型范围、表现形式和投入程度。",
          "让目标使用者能够实际理解或体验方案，并记录设计取舍。"
        ],
        "artifacts_to_keep": [
          "问题、关键假设、原型范围、版本变化和设计取舍之间可以相互对应。",
          "目标使用者能够完成具体体验，且方案产生了与学习目标相关的反馈。"
        ]
      },
      "observer_questions": [
        "学习者实际作出了哪些选择和判断？",
        "哪些结果来自 AI、同伴、教师或其他成人？",
        "学习者能否解释理由、限制以及需要求助的地方？",
        "换一种材料或情境后，相关行为能否再次出现？"
      ],
      "not_sufficient_evidence": [
        "只有精美成品，没有说明要解决的问题或检验的假设。",
        "完全照搬模板或 AI 生成方案，无法解释关键选择。"
      ],
      "fairness_cautions": [
        "制作技能和视觉质量会影响呈现，但不能替代对原型目的与范围的判断。"
      ],
      "boundaries": [
        "不要求一开始就制作功能完整或视觉精美的成品。",
        "不等同于机械执行一个预先给定的制作步骤。",
        "侧重把问题转化为可测试方案，与判断市场反馈相区分。"
      ]
    },
    {
      "competency_id": "BIZ-VAL-001",
      "age_policy": "不按年龄固定能力等级；结合经验、支持条件、任务风险和迁移表现判断。",
      "experience_progression": [
        "在示例、分步说明或成人支持下尝试",
        "借助清单、模板或同伴协作完成",
        "在熟悉且低风险的情境中独立完成",
        "在新的复杂情境中迁移、权衡并说明决定"
      ],
      "adult_responsibility": "成人负责招募、同意、数据保护和真实交易边界；青少年参与低风险测试与证据解释。",
      "evidence_task": {
        "setup": "使用虚构、合成、公开或充分去标识化的材料，安排低风险、可逆的任务。",
        "behaviors_to_elicit": [
          "在测试前写出可被支持或否定的价值假设和观察指标。",
          "选择接近目标人群与真实使用情境的测试方式。",
          "区分口头意见和实际行为，并根据证据保留、修改或放弃原判断。"
        ],
        "artifacts_to_keep": [
          "包含测试前假设、对象选择、行为记录、原始反馈、结论变化和后续行动。",
          "能够说明反对证据、测试局限以及哪些结论尚不能成立。"
        ]
      },
      "observer_questions": [
        "学习者实际作出了哪些选择和判断？",
        "哪些结果来自 AI、同伴、教师或其他成人？",
        "学习者能否解释理由、限制以及需要求助的地方？",
        "换一种材料或情境后，相关行为能否再次出现？"
      ],
      "not_sufficient_evidence": [
        "只展示点赞数、朋友称赞或由 AI 模拟的用户反馈。",
        "测试结束后才补写与结果一致的假设。"
      ],
      "fairness_cautions": [
        "样本接触机会受家庭与环境资源影响，不应把测试规模直接解释为能力高低。"
      ],
      "boundaries": [
        "不等同于只询问他人是否喜欢一个想法。",
        "不把一次购买、点赞或正面评价视为稳定价值的证明。",
        "不要求青少年承担超出其年龄、法律或经济责任范围的真实交易。"
      ]
    },
    {
      "competency_id": "PRO-PJM-001",
      "age_policy": "不按年龄固定能力等级；结合经验、支持条件、任务风险和迁移表现判断。",
      "experience_progression": [
        "在示例、分步说明或成人支持下尝试",
        "借助清单、模板或同伴协作完成",
        "在熟悉且低风险的情境中独立完成",
        "在新的复杂情境中迁移、权衡并说明决定"
      ],
      "adult_responsibility": "成人提供现实资源与制度支持，并承担机构依赖；青少年只对其可控制的承诺负责。",
      "evidence_task": {
        "setup": "使用虚构、合成、公开或充分去标识化的材料，安排低风险、可逆的任务。",
        "behaviors_to_elicit": [
          "用可检查的结果描述项目完成状态。",
          "识别关键任务之间的顺序、依赖和截止时间。",
          "根据进展、资源或风险变化更新计划。"
        ],
        "artifacts_to_keep": [
          "从初始计划到实际执行的版本变化及调整理由。",
          "任务、负责人、时间和最终交付物之间可以相互对应。"
        ]
      },
      "observer_questions": [
        "学习者实际作出了哪些选择和判断？",
        "哪些结果来自 AI、同伴、教师或其他成人？",
        "学习者能否解释理由、限制以及需要求助的地方？",
        "换一种材料或情境后，相关行为能否再次出现？"
      ],
      "not_sufficient_evidence": [
        "只提交由模板或 AI 生成的任务表。",
        "项目结束后补写但无法对应真实过程的计划。"
      ],
      "fairness_cautions": [
        "按时完成可能来自他人管理，必须识别学习者本人承担的规划部分。"
      ],
      "boundaries": [
        "不等同于制作看起来完整的任务清单。",
        "不要求使用特定项目管理软件。",
        "与持续执行和自我驱动相关，但不完全相同。"
      ]
    },
    {
      "competency_id": "PRO-COM-001",
      "age_policy": "不按年龄固定能力等级；结合经验、支持条件、任务风险和迁移表现判断。",
      "experience_progression": [
        "在示例、分步说明或成人支持下尝试",
        "借助清单、模板或同伴协作完成",
        "在熟悉且低风险的情境中独立完成",
        "在新的复杂情境中迁移、权衡并说明决定"
      ],
      "adult_responsibility": "成人提供安全表达与申诉渠道；不以口音、外向程度或成人职场话语评价青少年。",
      "evidence_task": {
        "setup": "使用虚构、合成、公开或充分去标识化的材料，安排低风险、可逆的任务。",
        "behaviors_to_elicit": [
          "根据沟通对象和目的选择必要信息、表达方式与详细程度。",
          "通过复述、追问或书面确认检查双方是否形成相同理解。",
          "在沟通结束时明确共识、未决问题、负责人和下一步。"
        ],
        "artifacts_to_keep": [
          "沟通材料、反馈、确认记录和后续行动能够形成连续证据链。",
          "出现误解或分歧后，学习者调整表达并促成可检查的进展。"
        ]
      },
      "observer_questions": [
        "学习者实际作出了哪些选择和判断？",
        "哪些结果来自 AI、同伴、教师或其他成人？",
        "学习者能否解释理由、限制以及需要求助的地方？",
        "换一种材料或情境后，相关行为能否再次出现？"
      ],
      "not_sufficient_evidence": [
        "只提交一份排版精美的演示文稿。",
        "由他人主导沟通，学习者只完成朗读或转发。"
      ],
      "fairness_cautions": [
        "语言流利度、社交风格和无障碍需求会影响表现形式，应评价沟通行动而非人格。"
      ],
      "boundaries": [
        "不等同于语言华丽、性格外向或在公开场合表现自信。",
        "不要求消除所有分歧或让所有人同意自己。",
        "侧重工作情境中的理解与推进，与一般表达技巧相区分。"
      ]
    },
    {
      "competency_id": "PRO-SEL-001",
      "age_policy": "不按年龄固定能力等级；结合经验、支持条件、任务风险和迁移表现判断。",
      "experience_progression": [
        "在示例、分步说明或成人支持下尝试",
        "借助清单、模板或同伴协作完成",
        "在熟悉且低风险的情境中独立完成",
        "在新的复杂情境中迁移、权衡并说明决定"
      ],
      "adult_responsibility": "成人保障休息、健康、求助与退出权；自我管理不能替代照护和制度责任。",
      "evidence_task": {